{
  "schema_version": 2,
  "id": "resource::concorda::regatta",
  "kind": "domain",
  "subkind": "resource",
  "title": "Regatta",
  "summary": "A race or race-day in the racing calendar. Carries metadata like scoring system, qualifier, course type, and organizing authority. Distinct from Event (the calendar atom) and Series (a collection of regattas).",
  "source": {
    "kind": "db_resource",
    "table": "regattas",
    "defined_in": "concorda-api/models/regatta.py"
  },
  "aliases": [
    "Regatta",
    "RegattaRead",
    "race"
  ],
  "definition_status": "human_reviewed",
  "structural_hash": "6581249a11ddbeed6cfc5ce0130174b961338168043155e1bd565e2216b4c87f",
  "dossier": "dossiers/domain/resource__concorda__regatta.md",
  "extractor": null
}
