{
  "schema_version": 2,
  "id": "role::relational::boat_owner",
  "kind": "domain",
  "subkind": "role",
  "title": "Boat Owner",
  "summary": "A person whose boat it is \u2014 registered the boat or was promoted to co-owner. Multiple owners are allowed and have equal authority.",
  "source": {
    "kind": "relational",
    "table": "BoatCrew",
    "predicate": "BoatCrew.role='owner' AND BoatCrew.status='active'",
    "defined_in": "concorda-api/models/boat_crew.py"
  },
  "aliases": [
    "boat-owner",
    "owner"
  ],
  "definition_status": "human_reviewed",
  "structural_hash": "9adde5c61387cca193ca36c3de9d07064deb3160c2c015b9b3a9210b597bf114",
  "dossier": "dossiers/domain/role__relational__boat_owner.md",
  "extractor": null
}
