{
  "schema_version": 2,
  "id": "role::system::event_manager",
  "kind": "domain",
  "subkind": "role",
  "title": "Event Manager",
  "summary": "A Member granted authority to manage events (regattas, social events) within scope. The role behind regatta create/edit/delete and event registration administration.",
  "source": {
    "kind": "system_role",
    "level": 30,
    "table": "Role",
    "seeded_in": "concorda-api/migrations/",
    "defined_in": "concorda-api/models/role.py"
  },
  "aliases": [
    "event_manager"
  ],
  "definition_status": "human_reviewed",
  "structural_hash": "e9c4bbe3e42f22f87c68841f77f92d375e18041292bd41de2640d50c32d8296e",
  "dossier": "dossiers/domain/role__system__event_manager.md",
  "extractor": null
}
