{
  "schema_version": 2,
  "id": "role::system::delegate",
  "kind": "domain",
  "subkind": "role",
  "title": "Delegate",
  "summary": "A Member granted limited admin authority within a single Organization \u2014 typically a fleet captain or steward who can manage a subset of club-side data without full admin powers.",
  "source": {
    "kind": "system_role",
    "level": 20,
    "table": "Role",
    "seeded_in": "concorda-api/migrations/",
    "defined_in": "concorda-api/models/role.py"
  },
  "aliases": [
    "delegate",
    "club_delegate"
  ],
  "definition_status": "human_reviewed",
  "structural_hash": "6b6b77a854b61129a859753ed9ac1a2f0ded68b269c0ca803b3193f01aeb71b0",
  "dossier": "dossiers/domain/role__system__delegate.md",
  "extractor": null
}
