{
  "schema_version": 2,
  "id": "resource::concorda::temporal_product",
  "kind": "domain",
  "subkind": "resource",
  "title": "TemporalProduct",
  "summary": "A purchasable membership or event-scoped product, scoped to a year. Carries grants_* flags that drive entitlements. Distinct from Product (per-event tickets) and Merchandise (physical goods).",
  "source": {
    "kind": "db_resource",
    "table": "temporal_products",
    "defined_in": "concorda-api/models/temporal_product.py"
  },
  "aliases": [
    "TemporalProduct",
    "Membership",
    "TemporalProductRead"
  ],
  "definition_status": "human_reviewed",
  "structural_hash": "f2b3e085b7d61e5bf4e0819633c1239a500fcff53f7998a8e2d14ea04815ac0f",
  "dossier": "dossiers/domain/resource__concorda__temporal_product.md",
  "extractor": null
}
